<?xml version="1.0"?>
<Plants xmlns:xsi="http://www.w3.org/2001/XMLSchema-instance"
        xsi:noNamespaceSchemaLocation="Plants.xsd">
    <category>
        <Title>Tree</Title>
       <plant>
           <name>buk</name>
           <height>1.5</height>
           <age>1</age>
       </plant>
        <plant>
            <name>oak</name>
            <height>2</height>
            <age>5</age>
        </plant>
    </category>
    <category>
        <Title>Bush</Title>
        <plant>
            <name>lilac</name>
            <height>0.4</height>
            <age>0.5</age>
        </plant>
        <plant>
            <name>currant</name>
            <height>0.3</height>
            <age>0.2</age>
        </plant>
        <plant>
            <name>gooseberry</name>
            <height>0.1</height>
            <age>0.2</age>
        </plant>
    </category>
</Plants>